<?xml version="1.0" encoding="UTF-8"?>
<!DOCTYPE xml-files SYSTEM "amdocs-xml-loader-config.dtd">
<xml-files type="IypSalesOps-XML">

   <xml-file code="ServiceManagerContractsSummary" location="http://cafrfd1y5wdev01.itsdo.sbc.com:8080/data/ServiceManager/Summary/Contracts.xml" />
   <xml-file code="ServiceManagerContractsTotal" location="http://cafrfd1y5wdev01.itsdo.sbc.com:8080/data/ServiceManager/Summary/ContractsTotal.xml" />
   <xml-file code="ServiceManagerContractsDetails" location="http://cafrfd1y5wdev01.itsdo.sbc.com:8080/data/ServiceManager/Details/Contracts-details.xml" />

   <xml-file code="ServiceManagerPendingItemsSummary" location="http://cafrfd1y5wdev01.itsdo.sbc.com:8080/data/ServiceManager/Summary/PendingItems.xml" />
   <xml-file code="ServiceManagerPendingItemsTotal" location="http://cafrfd1y5wdev01.itsdo.sbc.com:8080/data/ServiceManager/Summary/PendingItemsTotal.xml" />
   <xml-file code="ServiceManagerPendingItemsDetails" location="http://cafrfd1y5wdev01.itsdo.sbc.com:8080/data/ServiceManager/Details/PendingItems-details.xml" />

   <xml-file code="ServiceManagerInProgressItemsSummary" location="http://cafrfd1y5wdev01.itsdo.sbc.com:8080/data/ServiceManager/Summary/InProgressItems.xml" />
   <xml-file code="ServiceManagerInProgressItemsTotal" location="http://cafrfd1y5wdev01.itsdo.sbc.com:8080/data/ServiceManager/Summary/InProgressItemsTotal.xml" />
   <xml-file code="ServiceManagerInProgressItemsDetails" location="http://cafrfd1y5wdev01.itsdo.sbc.com:8080/data/ServiceManager/Details/InProgressItems-details.xml" />

   <xml-file code="ServiceManagerCompletedItemsSummary" location="http://cafrfd1y5wdev01.itsdo.sbc.com:8080/data/ServiceManager/Summary/CompletedItems.xml" />
   <xml-file code="ServiceManagerCompletedItemsTotal" location="http://cafrfd1y5wdev01.itsdo.sbc.com:8080/data/ServiceManager/Summary/CompletedItemsTotal.xml" />
   <xml-file code="ServiceManagerCompletedItemsDetails" location="http://cafrfd1y5wdev01.itsdo.sbc.com:8080/data/ServiceManager/Details/CompletedItems-details.xml" />

   <xml-file code="ServiceManagerQueryItemsSummary" location="http://cafrfd1y5wdev01.itsdo.sbc.com:8080/data/ServiceManager/Summary/QueryItems.xml" />
   <xml-file code="ServiceManagerQueryItemsTotal" location="http://cafrfd1y5wdev01.itsdo.sbc.com:8080/data/ServiceManager/Summary/QueryItemsTotal.xml" />
   <xml-file code="ServiceManagerQueryItemsDetails" location="http://cafrfd1y5wdev01.itsdo.sbc.com:8080/data/ServiceManager/Details/QueryItems-details.xml" />



   <xml-file code="IypCycleTimeLastYear" location="http://executive-advisor.web.att.com/data/IypCycleTime/cycle-time-last-year-stats-{type}.xml" clientObject="YearlyIypCycleTime" />
   <xml-file code="IypCycleTimeMonthlyByUmg" location="http://executive-advisor.web.att.com/data/IypCycleTime/UMG/{yyyy-dd}-{type}-monthly-cycle-time.xml " clientObject="MonthlyIypCycleTime" />
   <xml-file code="IypCycleTimeMonthlyByUdacGroup" location="http://executive-advisor.web.att.com/data/IypCycleTime/UDAC-GROUP/{yyyy-dd}-{udacGroup}-monthly-cycle-time.xml " clientObject="MonthlyIypCycleTime" />

</xml-files>